{
  "schema_version": 1,
  "architecture_id": "IXOR_FUNCTION_FIRST_BOTTLE_LABELER_REFERENCE",
  "machine_goal": {
    "id": "BOTTLE_LABELING_OPERATING_COHERENCE",
    "description": "Define and verify a realistic industrial bottle-labeling operating architecture from mechanism-independent product-handling and label-transfer obligations. Existing V43 Prism geometry is preserved as Candidate A research evidence but is not privileged as the required mechanism.",
    "geometry_state": "CANDIDATE_OPERATING",
    "mechanical_acceptance_granted": false
  },
  "subsystems": [
    {
      "id": "PRODUCT_TRANSPORT_AND_INDEXING",
      "parent_id": null,
      "goal": "Deliver one bottle to the controlled application position and prevent double-feed during the active cycle.",
      "local_obligation_ids": [
        "PRODUCT_POSITION_STABLE",
        "INDEX_HARDSTOP_SEQUENCE"
      ],
      "provided_interface_ids": [
        "TRANSPORT_TO_CAPTURE"
      ],
      "consumed_interface_ids": [
        "RELEASE_TO_TRANSPORT"
      ]
    },
    {
      "id": "CAPTURE_AND_ROTATION",
      "parent_id": null,
      "goal": "Establish and maintain controlled bottle support, restraint, justified rotation, wrap contact, and a supported reaction-force path while label application is active. No candidate mechanism family is privileged until screened against the common obligation set.",
      "local_obligation_ids": [
        "CAPTURE_KINEMATIC_OWNER",
        "BOTTLE_RESTRAINT_THROUGHOUT_CAPTURE",
        "BOTTLE_ROTATION_SOURCE_BOUND",
        "WRAP_CONTACT_THROUGHOUT_CAPTURE",
        "CAPTURE_REACTION_FORCE_PATH",
        "REACHABLE_MOTION_CLEARANCE"
      ],
      "provided_interface_ids": [
        "CAPTURE_TO_LABEL",
        "CAPTURE_TO_RELEASE"
      ],
      "consumed_interface_ids": [
        "TRANSPORT_TO_CAPTURE",
        "LABEL_TO_CAPTURE"
      ]
    },
    {
      "id": "LABEL_PRESENTATION_AND_TRANSFER",
      "parent_id": null,
      "goal": "Present label media at the correct time and maintain a mechanically meaningful label-transfer relationship during wrap.",
      "local_obligation_ids": [
        "LABEL_PRESENTATION_DURING_WRAP"
      ],
      "provided_interface_ids": [
        "LABEL_TO_CAPTURE"
      ],
      "consumed_interface_ids": [
        "CAPTURE_TO_LABEL"
      ]
    },
    {
      "id": "RELEASE_AND_NEIGHBOR_CLEARANCE",
      "parent_id": null,
      "goal": "Release the completed bottle and preserve clearance from the head, guides, stops, and neighboring products across reachable release motion.",
      "local_obligation_ids": [
        "RELEASE_PATH_CLEAR_ACROSS_REACHABLE_STATES"
      ],
      "provided_interface_ids": [
        "RELEASE_TO_TRANSPORT"
      ],
      "consumed_interface_ids": [
        "CAPTURE_TO_RELEASE"
      ]
    },
    {
      "id": "MACHINE_SUPPORT_AND_MOUNTING",
      "parent_id": null,
      "goal": "Provide supported, restrained mounting and a reaction-force path for the labeling and capture assemblies.",
      "local_obligation_ids": [
        "MOUNTING_SUPPORT_INTEGRITY"
      ],
      "provided_interface_ids": [],
      "consumed_interface_ids": []
    }
  ],
  "obligations": [
    {
      "id": "PRODUCT_POSITION_STABLE",
      "owner_subsystem_id": "PRODUCT_TRANSPORT_AND_INDEXING",
      "description": "Exactly one intended bottle is positioned at the application station before capture is authorized.",
      "verification_state": "UNRESOLVED",
      "ambiguity_bucket": "MEASUREMENT_REQUIRED",
      "criticality": 5,
      "resolution_cost": 1,
      "expected_authority": [
        "SOLIDWORKS_LIVE_STATE",
        "DETERMINISTIC_CALCULATION"
      ],
      "evidence_refs": [
        "E.V43.PRISM.LIVE_STATE.20260926T200826594Z"
      ],
      "depends_on_requirement_ids": [],
      "scope": {
        "state_ids": [
          "INDEXED"
        ],
        "transition_ids": [],
        "required_coverage": "POINT_ONLY"
      }
    },
    {
      "id": "INDEX_HARDSTOP_SEQUENCE",
      "owner_subsystem_id": "PRODUCT_TRANSPORT_AND_INDEXING",
      "description": "Index-stop behavior establishes product position and then releases without requiring a second product to enter the occupied station.",
      "verification_state": "UNRESOLVED",
      "ambiguity_bucket": "KINEMATIC_STATE_UNRESOLVED",
      "criticality": 5,
      "resolution_cost": 2,
      "expected_authority": [
        "SOLIDWORKS_LIVE_STATE",
        "DETERMINISTIC_CALCULATION"
      ],
      "evidence_refs": [
        "E.V43.PRISM.LIVE_STATE.20260926T200826594Z"
      ],
      "depends_on_requirement_ids": [
        "PRODUCT_POSITION_STABLE"
      ],
      "scope": {
        "state_ids": [
          "INDEXED",
          "RELEASE"
        ],
        "transition_ids": [
          "ENTRY_TO_INDEXED",
          "CAPTURE_TO_RELEASE"
        ],
        "required_coverage": "REACHABLE_STATE_SET"
      }
    },
    {
      "id": "CAPTURE_KINEMATIC_OWNER",
      "owner_subsystem_id": "CAPTURE_AND_ROTATION",
      "description": "The selected bottle capture/rotation architecture has an explicit physical owner for closure, guidance, rotation input, limits, compliance/preload when required, and release; selection follows mechanism-independent requirements and candidate screening rather than current CAD convenience.",
      "verification_state": "UNRESOLVED",
      "ambiguity_bucket": "KINEMATIC_STATE_UNRESOLVED",
      "criticality": 5,
      "resolution_cost": 1,
      "expected_authority": [
        "OEM_CAD",
        "OEM_DOCUMENTATION",
        "SOLIDWORKS_LIVE_STATE",
        "DETERMINISTIC_CALCULATION"
      ],
      "evidence_refs": [
        "E.V43.PRISM.LIVE_STATE.20260926T200826594Z",
        "E.V43.PRISM.MATE_BINDING.ARCH_PROJECTION.20260926",
        "E.V43.PRISM.GUIDE_CONTACT.ARCH_PROJECTION.20260927",
        "E.V43.PRISM.SLIDER_LINK_CONTACT.ARCH_PROJECTION.20260927",
        "E.V43.PRISM.LINK_ARM_CONTACT.ARCH_PROJECTION.20260927",
        "E.V43.PRISM.ARM_ROLLER_CONTACT.ARCH_PROJECTION.20260927",
        "E.V43.PRISM.FULL_CHAIN_MATES.ARCH_PROJECTION.20260927"
      ],
      "depends_on_requirement_ids": [],
      "scope": {
        "state_ids": [
          "CAPTURE_AND_ROTATION",
          "LABEL_TRANSFER_INTERVAL",
          "WRAP_ACTIVE"
        ],
        "transition_ids": [
          "INDEXED_TO_CAPTURE"
        ],
        "required_coverage": "REACHABLE_STATE_SET"
      }
    },
    {
      "id": "BOTTLE_RESTRAINT_THROUGHOUT_CAPTURE",
      "owner_subsystem_id": "CAPTURE_AND_ROTATION",
      "description": "Bottle restraint remains valid throughout capture and rotation rather than only at one fit-check pose.",
      "verification_state": "UNRESOLVED",
      "ambiguity_bucket": "KINEMATIC_STATE_UNRESOLVED",
      "criticality": 5,
      "resolution_cost": 2,
      "expected_authority": [
        "OEM_CAD",
        "SOLIDWORKS_LIVE_STATE",
        "DETERMINISTIC_CALCULATION"
      ],
      "evidence_refs": [
        "E.V43.PRISM.LIVE_STATE.20260926T200826594Z"
      ],
      "depends_on_requirement_ids": [
        "CAPTURE_KINEMATIC_OWNER"
      ],
      "scope": {
        "state_ids": [
          "CAPTURE_AND_ROTATION",
          "LABEL_TRANSFER_INTERVAL",
          "WRAP_ACTIVE"
        ],
        "transition_ids": [
          "INDEXED_TO_CAPTURE",
          "CAPTURE_TO_RELEASE"
        ],
        "required_coverage": "THROUGHOUT_SCOPE"
      }
    },
    {
      "id": "BOTTLE_ROTATION_SOURCE_BOUND",
      "owner_subsystem_id": "CAPTURE_AND_ROTATION",
      "description": "The candidate architecture explicitly identifies how bottle rotation is generated and controlled relative to the label lead and wrap-contact surfaces, including drive source, direction, contact relationship, and required operating interval.",
      "verification_state": "UNRESOLVED",
      "ambiguity_bucket": "KINEMATIC_STATE_UNRESOLVED",
      "criticality": 5,
      "resolution_cost": 2,
      "expected_authority": [
        "OEM_CAD",
        "OEM_DOCUMENTATION",
        "SOLIDWORKS_LIVE_STATE",
        "DETERMINISTIC_CALCULATION"
      ],
      "evidence_refs": [],
      "depends_on_requirement_ids": [
        "CAPTURE_KINEMATIC_OWNER"
      ],
      "scope": {
        "state_ids": [
          "CAPTURE_AND_ROTATION",
          "LABEL_TRANSFER_INTERVAL",
          "WRAP_ACTIVE"
        ],
        "transition_ids": [],
        "required_coverage": "THROUGHOUT_SCOPE"
      }
    },
    {
      "id": "WRAP_CONTACT_THROUGHOUT_CAPTURE",
      "owner_subsystem_id": "CAPTURE_AND_ROTATION",
      "description": "Required contact/tangency between the bottle and the justified wrap mechanism remains valid for the required wrap interval.",
      "verification_state": "UNRESOLVED",
      "ambiguity_bucket": "KINEMATIC_STATE_UNRESOLVED",
      "criticality": 5,
      "resolution_cost": 2,
      "expected_authority": [
        "SOLIDWORKS_LIVE_STATE",
        "DETERMINISTIC_CALCULATION"
      ],
      "evidence_refs": [
        "E.V43.PRISM.LIVE_STATE.20260926T200826594Z"
      ],
      "depends_on_requirement_ids": [
        "CAPTURE_KINEMATIC_OWNER"
      ],
      "scope": {
        "state_ids": [
          "CAPTURE_AND_ROTATION",
          "LABEL_TRANSFER_INTERVAL",
          "WRAP_ACTIVE"
        ],
        "transition_ids": [],
        "required_coverage": "THROUGHOUT_SCOPE"
      }
    },
    {
      "id": "CAPTURE_REACTION_FORCE_PATH",
      "owner_subsystem_id": "CAPTURE_AND_ROTATION",
      "description": "A supported reaction-force and restraint path exists for wrap drive, support rollers, bottle contact, and mounting structure.",
      "verification_state": "UNRESOLVED",
      "ambiguity_bucket": "KINEMATIC_STATE_UNRESOLVED",
      "criticality": 5,
      "resolution_cost": 2,
      "expected_authority": [
        "OEM_CAD",
        "OEM_DOCUMENTATION",
        "DETERMINISTIC_CALCULATION"
      ],
      "evidence_refs": [
        "E.V43.PRISM.LIVE_STATE.20260926T200826594Z",